{
  "schema_version": "0.3.0",
  "release_version": "0.3.0",
  "project_id": "NINEL",
  "layer": "production",
  "profile": "production",
  "artifacts": [
    {
      "filename": "production-design-plan.json",
      "schema_name": "production-design-plan",
      "schema_version": "0.3.0",
      "dependency_order": 1
    },
    {
      "filename": "character-look-bible.json",
      "schema_name": "character-look-bible",
      "schema_version": "0.3.0",
      "dependency_order": 2
    },
    {
      "filename": "animation-plan.json",
      "schema_name": "animation-plan",
      "schema_version": "0.3.0",
      "dependency_order": 3
    },
    {
      "filename": "vfx-plan.json",
      "schema_name": "vfx-plan",
      "schema_version": "0.3.0",
      "dependency_order": 4
    },
    {
      "filename": "media-prompt-package.json",
      "schema_name": "media-prompt-package",
      "schema_version": "0.3.0",
      "dependency_order": 5
    },
    {
      "filename": "media-review-report.json",
      "schema_name": "media-review-report",
      "schema_version": "0.3.0",
      "dependency_order": 6
    },
    {
      "filename": "production-manifest.json",
      "schema_name": "layer-manifest",
      "schema_version": "0.3.0",
      "dependency_order": 7
    }
  ],
  "validation_status": "valid",
  "unresolved_questions": []
}
