{
  "schema_version": "0.3.0",
  "release_version": "0.3.0",
  "project_id": "NINEL",
  "layer": "script",
  "profile": "story",
  "artifacts": [
    {
      "filename": "unit-outline.json",
      "schema_name": "unit-outline",
      "schema_version": "0.3.0",
      "dependency_order": 1
    },
    {
      "filename": "screenplay.fountain",
      "schema_name": "fountain",
      "schema_version": "0.3.0",
      "dependency_order": 2
    },
    {
      "filename": "screenplay-metadata.json",
      "schema_name": "screenplay-metadata",
      "schema_version": "0.3.0",
      "dependency_order": 3
    },
    {
      "filename": "script-revision-plan.json",
      "schema_name": "script-revision-plan",
      "schema_version": "0.3.0",
      "dependency_order": 4
    },
    {
      "filename": "scenes",
      "schema_name": "scene-full",
      "schema_version": "0.3.0",
      "dependency_order": 5
    },
    {
      "filename": "script-manifest.json",
      "schema_name": "layer-manifest",
      "schema_version": "0.3.0",
      "dependency_order": 6
    }
  ],
  "validation_status": "valid",
  "unresolved_questions": []
}
